{
    "aanvrager": {
        "naam": "Daan Kok",
        "email": "daan.kok@example.com"
    },
    "nieuwAdres": "Markt 1, 6211 CH Maastricht",
    "status": "in_behandeling",
    "spoed": null,
    "aantalPersonen": 6,
    "oppervlakte": 140.25,
    "afgerond": false,
    "aantalKamers": 5,
    "geschatteWaarde": 410000.0
}
